{
  "schema_version": 1,
  "name": "Circle and parabola: positive intersection",
  "variables": ["x", "y"],
  "polynomials": [
    [
      {"coefficient": "1", "powers": [2, 0]},
      {"coefficient": "1", "powers": [0, 2]},
      {"coefficient": "-1", "powers": [0, 0]}
    ],
    [
      {"coefficient": "1", "powers": [2, 0]},
      {"coefficient": "-1", "powers": [0, 1]}
    ]
  ],
  "center": ["4/5", "3/5"],
  "radii": ["1/20", "1/20"],
  "preconditioner": [
    ["25/88", "15/44"],
    ["5/11", "-5/11"]
  ]
}
